{
  "schema_version": "1.1.0",
  "video_id": "VID-2026-10-12-001",
  "client_id": "3fa85f64-5717-4562-b3fc-2c963f66afa6",
  "raw_video_id": "9b2f1e3a-6c4d-4a2b-8e1f-2d3c4b5a6e7f",
  "template_id": "prueba_social_v1",
  "platform": "instagram_reels",
  "aspect_ratio": "9:16",
  "canvas": { "width": 1080, "height": 1920 },
  "source_video": {
    "url": "https://storage.nexo-ia.cl/raw/3fa85f64-5717-4562-b3fc-2c963f66afa6/VID-2026-10-12-001.mp4",
    "duration_sec": 20.8
  },
  "duration": { "target_sec": 20.8 },
  "cuts": [{ "start": 0.0, "end": 20.8, "keep": true }],
  "hook": {
    "text": "Esto lo editó la IA, no yo",
    "emphasis_words": ["IA"],
    "display_start": 0,
    "display_end": 2.5
  },
  "subtitles": {
    "style": {
      "font_family": "Manrope",
      "font_size": 48,
      "color": "#FFFFFF",
      "highlight_color": "#F2A93B",
      "position": "bottom"
    },
    "lines": [
      { "start": 0.0, "end": 2.5, "text": "Esto acaba de dejar sin trabajo", "emphasis": true },
      { "start": 2.5, "end": 4.5, "text": "a los editores de video", "emphasis": false },
      { "start": 4.5, "end": 7.0, "text": "porque este reel lo edité 100%", "emphasis": false },
      { "start": 7.0, "end": 8.5, "text": "con IA", "emphasis": true },
      { "start": 8.5, "end": 11.0, "text": "lo único que tuve que hacer", "emphasis": false },
      { "start": 11.0, "end": 13.0, "text": "fue sentarme en el sofá", "emphasis": false },
      { "start": 13.0, "end": 16.0, "text": "y pedirle que le ponga", "emphasis": false },
      { "start": 16.0, "end": 18.5, "text": "subtítulos, efectos y música", "emphasis": false },
      { "start": 18.5, "end": 20.8, "text": "comentá DISEÑO y te mando el prompt", "emphasis": true }
    ]
  },
  "overlays": [
    {
      "id": "stat-counter",
      "type": "image",
      "image_url": "https://cdn.nexo-ia.cl/overlays/prueba-social-v1/stat-counter.png",
      "start": 5.2,
      "end": 9.0,
      "position": { "x": 0.5, "y": 0.62 }
    },
    {
      "id": "chat-prompt-mockup",
      "type": "image",
      "image_url": "https://cdn.nexo-ia.cl/overlays/prueba-social-v1/chat-prompt-mockup.png",
      "start": 10.4,
      "end": 14.0,
      "position": { "x": 0.5, "y": 0.68 }
    },
    {
      "id": "editing-timeline-mockup",
      "type": "image",
      "image_url": "https://cdn.nexo-ia.cl/overlays/prueba-social-v1/editing-timeline-mockup.png",
      "start": 15.6,
      "end": 19.0,
      "position": { "x": 0.5, "y": 0.65 }
    },
    {
      "id": "cta-notification-mockup",
      "type": "image",
      "image_url": "https://cdn.nexo-ia.cl/overlays/prueba-social-v1/cta-notification-mockup.png",
      "start": 17.5,
      "end": 20.8,
      "position": { "x": 0.5, "y": 0.7 }
    }
  ],
  "compare": {
    "enabled": true,
    "top_label": "Original",
    "top_badge_text": "IMG_6632.MOV · SIN TOCAR",
    "bottom_label_prefix": "Editado por",
    "bottom_label_highlight": "Claude Opus 5.5",
    "bottom_label_accent_color": "#F2A93B"
  },
  "zoom_keyframes": [],
  "progress_bar": { "enabled": true, "color": "#F2A93B" },
  "branding": {
    "logo_url": "https://cdn.nexo-ia.cl/clients/3fa85f64-5717-4562-b3fc-2c963f66afa6/logo.png",
    "primary_color": "#1B2A4A",
    "accent_color": "#F2A93B",
    "handle": "@nexo.ia",
    "watermark_position": "bottom_right"
  },
  "end_card": { "enabled": false },
  "meta": {
    "created_by": "human_edit",
    "created_at": "2026-10-12T19:30:00Z",
    "version": 1
  }
}
